{
  "schema_version": "1.0",
  "article_id": "9718751f4a42ff0142b8e9345b75cbabce567f42a370679e704a30fada6690b7",
  "source_url": "https://cafef.vn/du-lieu/HCM-2956749/hcm-thong-bao-phat-hanh-cp-theo-chuong-trinh-lua-chon-cho-nld.chn?utm_source=du-lieu",
  "domain": "cafef.vn",
  "published_at": "2026-08-17T15:17:34+07:00",
  "raw_html_path": "data/raw_html\\cafef.vn\\20260817\\9718751f4a42ff0142b8e9345b75cbabce567f42a370679e704a30fada6690b7.html",
  "raw_sha256": "273643d77acc5ec5d05e0039d140188cfa6ba4c1046b6242c2cd37325f1de2dc",
  "cleaned_text": "|  | \n|  | \n|  | \n|  | \n| THÔNG TIN CÔNG TY | Thứ 2, 17/08/2026, 15:17 | \n| \n         HCM\n      Công ty Cổ phần Chứng khoán Thành phố Hồ Chí Minh (HOSE) | \n|  | \n|  | \n| Giá hiện tại: HCM |  | 25,3 | +0,1(+0,4%) |  |  | Hồ sơ công ty | GDCĐ lớn & CĐ nội bộ |  | \n| HCM: Thông báo phát hành CP theo chương trình lựa chọn cho NLĐ | \n| Công ty Cổ phần Chứng khoán Thành phố Hồ Chí Minh thông báo phát hành CP theo chương trình lựa chọn cho NLĐ như sau: Các tập tin đính kèm Theo HOSE |",
  "structure": {
    "headings": [
      {
        "level": 2,
        "text": "THÔNG TIN CÔNG TY"
      },
      {
        "level": 1,
        "text": "Công ty Cổ phần Chứng khoán Thành phố Hồ Chí Minh (HOSE)"
      },
      {
        "level": 5,
        "text": "Các tập tin đính kèm"
      }
    ],
    "paragraphs": [
      "MỚI NHẤT!",
      "Công ty Cổ phần Chứng khoán Thành phố Hồ Chí Minh thông báo phát hành CP theo chương trình lựa chọn cho NLĐ như sau:",
      "Theo HOSE",
      "Ban biên tập CafeF",
      "Địa chỉ: Tầng 21 Tòa nhà Center Building. Số 1 Nguyễn Huy Tưởng, Thanh Xuân, Hà Nội.",
      "Điện thoại: 024 73095555 Máy lẻ 322",
      "Email: info@cafef.vn | Hotline: 0966 909 747",
      "Chịu trách nhiệm nội dung: Ông Nguyễn Thế Tân",
      "Liên hệ quảng cáo",
      "Hotline: 0794463333 - 0961984388",
      "Email: doanhnghiep@admicro.vn",
      "Liên hệ dữ liệu",
      "Hotline: 0966 909 747",
      "Email: dulieu@cafef.vn",
      "© Copyright 2007 - 2026 - Công ty Cổ phần VCCorp.",
      "Giấy phép thiết lập trang thông tin điện tử tổng hợp trên mạng số 2216/GP-TTĐT do Sở Thông tin và Truyền thông Hà Nội cấp ngày 10 tháng 4 năm 2019."
    ],
    "tables": [
      [
        [
          "Tin tức Xã hội Doanh nghiệp Kinh tế vĩ mô",
          "Tài chính - Chứng khoán Chứng khoán Tài chính ngân hàng Tài chính quốc tế",
          "Bất động sản Tin tức Dự án Bản đồ dự án",
          "Khác Hàng hóa nguyên liệu Sống Lifestyle"
        ]
      ],
      [
        [
          "THÔNG TIN CÔNG TY Thứ 2, 17/08/2026, 15:17 CafeF.vn > Dữ liệu HCM Công ty Cổ phần Chứng khoán Thành phố Hồ Chí Minh (HOSE) Giá hiện tại: HCM 25,3 +0,1(+0,4%) Hồ sơ công ty GDCĐ lớn & CĐ nội bộ HCM: Thông báo phát hành CP theo chương trình lựa chọn cho NLĐ Công ty Cổ phần Chứng khoán Thành phố Hồ Chí Minh thông báo phát hành CP theo chương trình lựa chọn cho NLĐ như sau: Các tập tin đính kèm 20260817 - HCM - Thong bao phat hanh co phieu ESOP 2026.pdf Theo HOSE",
          "THÔNG TIN CÔNG TY Thứ 2, 17/08/2026, 15:17",
          "THÔNG TIN CÔNG TY",
          "Thứ 2, 17/08/2026, 15:17",
          "CafeF.vn > Dữ liệu HCM Công ty Cổ phần Chứng khoán Thành phố Hồ Chí Minh (HOSE) Giá hiện tại: HCM 25,3 +0,1(+0,4%) Hồ sơ công ty GDCĐ lớn & CĐ nội bộ HCM: Thông báo phát hành CP theo chương trình lựa chọn cho NLĐ Công ty Cổ phần Chứng khoán Thành phố Hồ Chí Minh thông báo phát hành CP theo chương trình lựa chọn cho NLĐ như sau: Các tập tin đính kèm 20260817 - HCM - Thong bao phat hanh co phieu ESOP 2026.pdf Theo HOSE",
          "CafeF.vn > Dữ liệu HCM Công ty Cổ phần Chứng khoán Thành phố Hồ Chí Minh (HOSE)",
          "Giá hiện tại: HCM 25,3 +0,1(+0,4%) Hồ sơ công ty GDCĐ lớn & CĐ nội bộ",
          "Giá hiện tại: HCM",
          "",
          "25,3",
          "+0,1(+0,4%)",
          "",
          "",
          "Hồ sơ công ty",
          "GDCĐ lớn & CĐ nội bộ",
          "",
          "HCM: Thông báo phát hành CP theo chương trình lựa chọn cho NLĐ Công ty Cổ phần Chứng khoán Thành phố Hồ Chí Minh thông báo phát hành CP theo chương trình lựa chọn cho NLĐ như sau: Các tập tin đính kèm 20260817 - HCM - Thong bao phat hanh co phieu ESOP 2026.pdf Theo HOSE",
          "HCM: Thông báo phát hành CP theo chương trình lựa chọn cho NLĐ",
          "Công ty Cổ phần Chứng khoán Thành phố Hồ Chí Minh thông báo phát hành CP theo chương trình lựa chọn cho NLĐ như sau: Các tập tin đính kèm 20260817 - HCM - Thong bao phat hanh co phieu ESOP 2026.pdf Theo HOSE"
        ],
        [
          "THÔNG TIN CÔNG TY Thứ 2, 17/08/2026, 15:17",
          "THÔNG TIN CÔNG TY",
          "Thứ 2, 17/08/2026, 15:17"
        ],
        [
          "THÔNG TIN CÔNG TY",
          "Thứ 2, 17/08/2026, 15:17"
        ],
        [
          "CafeF.vn > Dữ liệu HCM Công ty Cổ phần Chứng khoán Thành phố Hồ Chí Minh (HOSE) Giá hiện tại: HCM 25,3 +0,1(+0,4%) Hồ sơ công ty GDCĐ lớn & CĐ nội bộ HCM: Thông báo phát hành CP theo chương trình lựa chọn cho NLĐ Công ty Cổ phần Chứng khoán Thành phố Hồ Chí Minh thông báo phát hành CP theo chương trình lựa chọn cho NLĐ như sau: Các tập tin đính kèm 20260817 - HCM - Thong bao phat hanh co phieu ESOP 2026.pdf Theo HOSE",
          "CafeF.vn > Dữ liệu HCM Công ty Cổ phần Chứng khoán Thành phố Hồ Chí Minh (HOSE)",
          "Giá hiện tại: HCM 25,3 +0,1(+0,4%) Hồ sơ công ty GDCĐ lớn & CĐ nội bộ",
          "Giá hiện tại: HCM",
          "",
          "25,3",
          "+0,1(+0,4%)",
          "",
          "",
          "Hồ sơ công ty",
          "GDCĐ lớn & CĐ nội bộ",
          "",
          "HCM: Thông báo phát hành CP theo chương trình lựa chọn cho NLĐ Công ty Cổ phần Chứng khoán Thành phố Hồ Chí Minh thông báo phát hành CP theo chương trình lựa chọn cho NLĐ như sau: Các tập tin đính kèm 20260817 - HCM - Thong bao phat hanh co phieu ESOP 2026.pdf Theo HOSE",
          "HCM: Thông báo phát hành CP theo chương trình lựa chọn cho NLĐ",
          "Công ty Cổ phần Chứng khoán Thành phố Hồ Chí Minh thông báo phát hành CP theo chương trình lựa chọn cho NLĐ như sau: Các tập tin đính kèm 20260817 - HCM - Thong bao phat hanh co phieu ESOP 2026.pdf Theo HOSE"
        ],
        [
          "CafeF.vn > Dữ liệu HCM Công ty Cổ phần Chứng khoán Thành phố Hồ Chí Minh (HOSE)"
        ],
        [
          "Giá hiện tại: HCM 25,3 +0,1(+0,4%) Hồ sơ công ty GDCĐ lớn & CĐ nội bộ",
          "Giá hiện tại: HCM",
          "",
          "25,3",
          "+0,1(+0,4%)",
          "",
          "",
          "Hồ sơ công ty",
          "GDCĐ lớn & CĐ nội bộ",
          ""
        ],
        [
          "Giá hiện tại: HCM",
          "",
          "25,3",
          "+0,1(+0,4%)",
          "",
          "",
          "Hồ sơ công ty",
          "GDCĐ lớn & CĐ nội bộ",
          ""
        ],
        [
          "HCM: Thông báo phát hành CP theo chương trình lựa chọn cho NLĐ Công ty Cổ phần Chứng khoán Thành phố Hồ Chí Minh thông báo phát hành CP theo chương trình lựa chọn cho NLĐ như sau: Các tập tin đính kèm 20260817 - HCM - Thong bao phat hanh co phieu ESOP 2026.pdf Theo HOSE",
          "HCM: Thông báo phát hành CP theo chương trình lựa chọn cho NLĐ",
          "Công ty Cổ phần Chứng khoán Thành phố Hồ Chí Minh thông báo phát hành CP theo chương trình lựa chọn cho NLĐ như sau: Các tập tin đính kèm 20260817 - HCM - Thong bao phat hanh co phieu ESOP 2026.pdf Theo HOSE"
        ],
        [
          "HCM: Thông báo phát hành CP theo chương trình lựa chọn cho NLĐ"
        ],
        [
          "Công ty Cổ phần Chứng khoán Thành phố Hồ Chí Minh thông báo phát hành CP theo chương trình lựa chọn cho NLĐ như sau: Các tập tin đính kèm 20260817 - HCM - Thong bao phat hanh co phieu ESOP 2026.pdf Theo HOSE"
        ],
        [
          "[ Quay về ] Facebook"
        ],
        [
          "Các tin khác HCM: Báo cáo kết quả giao dịch cổ phiếu của người nội bộ Nguyễn Thị Hoàng Lan HCM: Báo cáo kết quả giao dịch cổ phiếu của người nội bộ Nguyễn Thị Hoàng Lan HCM: Thông báo phát hành CP theo chương trình lựa chọn cho NLĐ HCM: Thông báo phát hành CP theo chương trình lựa chọn cho NLĐ HCM: Thông báo giao dịch quyền mua CP của người nội bộ Lê Anh Minh, Thân Thị Thu Dung HCM: Thông báo giao dịch quyền mua CP của người nội bộ Lê Anh Minh, Thân Thị Thu Dung HCM: Thông báo nhận được Quyết định của Sở GDCKVN về việc chấp thuận tham gia hệ thống giao dịch các - bon đối với HCM HCM: Nghị quyết HĐQT thông qua phương án chào bán và niêm yết chứng quyền có bảo đảm đợt 21 HCM: Ông Lê Anh Quân - Người Công bố thông tin đã bán 600.000 cp HCM: Công ty Đầu tư Tài chính Nhà nước T.P Hồ Chí Minh đăng ký thực hiện 121.638.398 quyền mua cp Xem tiếp",
          "Các tin khác",
          "HCM: Báo cáo kết quả giao dịch cổ phiếu của người nội bộ Nguyễn Thị Hoàng Lan HCM: Báo cáo kết quả giao dịch cổ phiếu của người nội bộ Nguyễn Thị Hoàng Lan HCM: Thông báo phát hành CP theo chương trình lựa chọn cho NLĐ HCM: Thông báo phát hành CP theo chương trình lựa chọn cho NLĐ HCM: Thông báo giao dịch quyền mua CP của người nội bộ Lê Anh Minh, Thân Thị Thu Dung HCM: Thông báo giao dịch quyền mua CP của người nội bộ Lê Anh Minh, Thân Thị Thu Dung HCM: Thông báo nhận được Quyết định của Sở GDCKVN về việc chấp thuận tham gia hệ thống giao dịch các - bon đối với HCM HCM: Nghị quyết HĐQT thông qua phương án chào bán và niêm yết chứng quyền có bảo đảm đợt 21 HCM: Ông Lê Anh Quân - Người Công bố thông tin đã bán 600.000 cp HCM: Công ty Đầu tư Tài chính Nhà nước T.P Hồ Chí Minh đăng ký thực hiện 121.638.398 quyền mua cp Xem tiếp",